"job_title","hiring_companies","location","salary","job_url","job_description"
"Data Review Scientist","System One","Valley Forge, PA",NA,"https://job-openings.monster.com/data-review-scientist-valley-forge-pa-us-system-one/212340291","Title: Data Review SceintistLocation: King of Prussia, PaSchedule: Day shiftType: Contract to HireStart date: Immediate Responsibilities:Perform data review and analysis on client dataAccurately compile results of environmental testingWrite detailed summaries of data for each client and testing facilityIdentify and research data abnormalitiesRequirements:Bachelor’s degree in the life sciences requiredExperience performing data review and data analysisStrong written and verbal communication skillsMust be trainable and hoping to grow within a companyStrong understanding of analytical testing preferredExperience performing ICP-MS preferredExperience working in the life sciences industry, prefer experience in the environmental industry Joule, a System One division is a leader in specialized workforce solutions and integrated services. With more than 6,000 employees and roughly 50 offices throughout the U.S. we provide scientific, clinical, engineering, energy, IT, legal and administrative staffing services. For more than 40 years, we have delivered workforce solutions and integrated services to clients nationally."
"Data Scientist","Adam Kay Group","Saint Joseph, MI",NA,"https://job-openings.monster.com/data-scientist-saint-joseph-mi-us-adam-kay-group/212186127","My SW Lower Michigan client is in need of a Data Scientist to join their team. This person will part of the Enterprise Analytics team, will help build an assortment of models that will have a direct impact into the relationship between our customers and the company. The goal is to anticipate needs and add value. You will implement machine learning algorithms, drive data science analysis for decision making, and build efforts through to production. Perform exploratory and targeted data analyses using statistics and various other methods. Skills for this position will include:Master’s degree (required) in Computer Science, Engineering, Operations Research, Math, Finance, or other quantitative discipline (e.g. Statistics, Data Science, etc.).At least 3 years of professional experience.Experience modeling language such as R or Python, and/or other statistical software such as SAS.Knowledge of various Machine Learning techniques.Experience with relevant statistical measures (e.g., confidence intervals, significance of error measurements, multivariate testing, etc.) in data analysis projects.Experience with SQL. No remote, contract/ C2C or sponsorship is available for this position. Must be authorized to work in the US without expiration and willing to work and live in SW Lower Michigan."
"Chief Data Scientist","Booz Allen Hamilton","Alexandria, VA",NA,"https://job-openings.monster.com/chief-data-scientist-alexandria-va-us-booz-allen-hamilton/11fb8116-487b-45d7-bb29-c5284a467934","Job Number: R0024324Chief Data ScientistKey Role:Serve as a senior technical leader of a data science and machine intelligence team, leveraging expertise with consulting to define business problems, work with and manipulate data, develop data science and machine learning algorithms and solutions, and develop machine learning models into production environments. Work across client sets to address business challenges, perform analysis, and explain the analysis to senior clients. Lead the identification of opportunities to apply knowledge and expertise of deep learning technologies to develop prototypes and analytic models to challenges with new and existing clients through the application of new, innovative capabilities. Lead and support engagements across government clients. Provide thought leadership, drive business growth within the market, and develop and maintain client relationships. Take an active role in the development, mentoring, and coaching of the team, work actively to enhance the diversity of the firm, and play a lead role in attracting, developing, and retaining talent.Basic Qualifications-10+ years of experience with designing, developing, and leading analytics or software development projects in Java, Scala, or other high-level languages-10 years of experience with program management in the IC-Experience with managing national intelligence programs-Experience in the application of data science and machine learning algorithms, including structured, unstructured, or relational and data mining and machine learning techniques-Experience with developing and mentoring staff at all levels and building an internal capacity to deliver high quality and highly innovative analytics services-Experience with developing and implementing successful market strategy and business development and leading proposal, project, and intellectual capital creation-Ability to manage programs with competing priorities-Active Top Secret clearance-BA or BS degree requiredAdditional Qualifications-Experience with developing analytics for geospatial and commercial imagery data-Experience with developing and driving cross-cutting capabilities or solutions-Experience with deep learning frameworks, including Theano, Torch, Caffe, or AWS Rekognition-Experience with Natural Language Processing toolkits, including Stanford NLP or OpenNLP-Experience with business development and leading proposal, project, and intellectual capital creation-Ability to be well-versed in modern software development techniques, methods, and technologies-MS degree in Computer Science, Mathematics, or Physics preferred; PhD degree in Computer Science, Mathematics, or Physics a plusClearanceApplicants selected will be subject to a security investigation and may need to meet eligibility requirements for access to classified information; Top Secret clearance is required.We're an EOE that empowers our people-no matter their race, color, religion, sex, gender identity, sexual orientation, national origin, disability, veteran status, or other protected characteristic-to fearlessly drive change."
"Data Scientists","Advantage Resourcing","Dearborn, MI",NA,"https://job-openings.monster.com/data-scientists-dearborn-mi-us-advantage-resourcing/212367287","Position Description:Apply Data Science and build models to solve complex business problems. Build predictive models and machine learning algorithms, analyze large amounts of information to discover trends and patterns, undertake the preprocessing of structured and unstructured data as well as monitor and sustain model effectiveness. Combine models through ensemble modeling, present complex information using data visualization techniques and propose solutions and strategies to business challenges that drive business decisions.Skills Required:Proficient in one or more core analytical tools/suites/ languages/Databases such as Python, R, Spark Scala, Pig, Hive, SQL, Hadoop, Alteryx, Qlikview, Tableau and understand their limitations Proficient in one or more analytical methodologies such as numerical optimization, econometric modeling and forecasting, Statistical modeling, machine learning, optimization, simulation methods and text analytics Ability to present results to the business client and analytic peers Well developed communication skills both verbal and writtenSkills Preferred:Proficiency in Machine Learning Toolkits and/or Programming Languages which may include all or a subset of Python, Java, Scala, Spark, Tensor Flow. Spark is currently a preferred toolset.Experience Required:2 Years of professional experience in building complex models using large data setsExperience Preferred:Prefer - 3 or more years of experience desiredEducation Required:BS - Computer Science, Engineering, Statistics, mathematics, Physics or related fields MS in Data ScienceEducation Preferred:PhD- Data Science, mathematicsAdvantage Resourcing is committed to providing equal employment opportunity for all persons regardless of race, color, religion, sex,sexual orientation, gender identity, age, marital status, national origin, citizenship status, disability or veteran status."
"Clinical Data Scientist (Manager)","Pfizer","Cambridge, MA",NA,"https://job-openings.monster.com/clinical-data-scientist-manager-cambridge-ma-us-pfizer/212886986","ROLE SUMMARYAs part of the Data Monitoring and Management group, an integral delivery unit within the Global Product Development (GPD) organization, the Clinical Data Scientist is responsible for timely and high quality data management deliverables supporting the Pfizer portfolio. The Clinical Data Scientist designs, develops, and maintains key data management deliverables used to collect, review, monitor, and ensure the integrity of clinical data, oversees application of standards, data review and query management, and is accountable for quality study data set release and consistency in asset/submission data.ROLE RESPONSIBILITIES Clinical Data ScientistServe as Clinical Data Scientist for one or more clinical trials assuming responsibility for all DM&M activities including selection and application of data acquisition standards, Data Management Plan, selection of quality risk indicators, third party study data due diligenceParticipates and ensures quality database design including documentation, testing and implementation of clinical data collection tools, both CRF and non-CRF, using an electronic data capture (EDC) system and/or other data collection systems. Serve as a technical resource to the study teams for DM and RBM standards, tools, data provisioning, and reportingPartners with Research/Business Units and any external DM service provider to deliver high quality data management for all studies as assigned.Proactively drives quality and efficiency to meet timeline and milestones for data management, ensuring scientific and operational excellence in support of strategic imperatives and in collaboration with the cross functional study team (s).Ensure work carried out by DM providers is in accordance with applicable SOPs and working practices.Ensure the required study-specific DM&M documents in the Trial Master File (TMF) are of high quality and are filed contemporaneously.Ensure operational excellence in collaboration with partners for application of standards, data acquisition, proactive data review and data integrity monitoring, data cleaning, e-data processing, data access and visualization, and database release.QUALIFICATIONS Proficient experience using Oracle Inform EDC softwareExperience with Oracle DMW preferredWorking experience applying CDISC CDASH standardsDemonstrated successful experience in all relevant clinical data management activities in a BioPharmaceutical or CRO settingWorking knowledge of all phases of clinical trials and ability to assess and determine study requirement from protocol reviewStrong Project and Risk ManagementCRO and vendor oversight experience preferredStrong verbal and written communication skillsConsistent, detail oriented, communicative, dedicated to do a job well doneMinimum 5 years Data Management experience requiredWorking knowledge of clinical research, FDA & ICH, GCP, GCDMP, and related regulatory requirementsExperience using data visualization tools (e.g. Spotfire, jReview)Familiarity with MedDRA/WHO-DrugProficiency in the use of Microsoft Office Suite of tools (Outlook, Word, Excel, etc.)Bachelor’s degree required or at least 15 years of relevant data management experience.#LI-PFEEEO & Employment EligibilityPfizer is committed to equal opportunity in the terms and conditions of employment for all employees and job applicants without regard to race, color, religion, sex, sexual orientation, age, gender identity or gender expression, national origin, disability or veteran status. Pfizer also complies with all applicable national, state and local laws governing nondiscrimination in employment as well as work authorization and employment eligibility verification requirements of the Immigration and Nationality Act and IRCA. Pfizer is an E-Verify employer.Sunshine ActPfizer reports payments and other transfers of value to health care providers as required by federal and state transparency laws and implementing regulations. These laws and regulations require Pfizer to provide government agencies with information such as a health care provider’s name, address and the type of payments or other value received, generally for public disclosure. Subject to further legal review and statutory or regulatory clarification, which Pfizer intends to pursue, reimbursement of recruiting expenses for licensed physicians may constitute a reportable transfer of value under the federal transparency law commonly known as the Sunshine Act. Therefore, if you are a licensed physician who incurs recruiting expenses as a result of interviewing with Pfizer that we pay or reimburse, your name, address and the amount of payments made currently will be reported to the government. If you have questions regarding this matter, please do not hesitate to contact your Talent Acquisition representative.Pfizer is an equal opportunity employer and complies with all applicable equal employment opportunity legislation in each jurisdiction in which it operates."
"SAP IS-U Billing and Invoicing Consultant","ITTConnect","Toronto, ON",NA,"https://job-openings.monster.com/sap-is-u-billing-invoicing-consultant-toronto-on-ca-ittconnect/212417023","ITTConnect is seeking a SAP ISU Billing and Invoicing Consultant for a Direct Hire position with a client that is a global Management Consulting firm with over 200k employees worldwide. Job Location: Toronto area, local or willing to relocate ***No C2C / Visa Sponsorship / Independent Consultants***Requirements8+ years of experience with SAP Must have SAP IS-Utilities Billing and Invoiceing hands on experienceExperience in CR/B implementation project and participated in cutover activities.Strong understanding in SAP middleware functions including BDOC architecture, replication, message queues, and request processing.Strong Business knowledge in the SAP IS-Utilities, ISU-CCS business processes in Business/Technical master data (BP, Contract Partner, Contracts, Connection Objects, premise, Installation, PODs),Participate and contribute to Business Workshops and contribute to Solution Design document for SAP CRM Business Master data. Experience in configuring business master data Set up and knowledge in replication to other system.Management Consulting experience preferredMust have availability for extensive travelBS in Computer Science, Computer Engineering or similar"
"Senior Data Scientist","Monster","Weston, MA",NA,"https://job-openings.monster.com/senior-data-scientist-weston-ma-us-monster/212256607","Bring Big Data to Life!The Senior Data Scientist at Monster Worldwide in our Weston, MA Headquarters, will solve complex business problems using advanced statistical methods. The role will be able to work independently or guide junior Data Scientists on various Data Science, Automated ML and Data Engineering tasks. The role will execute a Data Science project from end to end, from participating in stakeholder meetings and defining business problems, to delivery of analytic outputs and implementation of findings.Our Data Science Team delivers analytic solutions across a wide variety of Monster applications. We build and inferential and predictive models, including machine learning algorithms and AI, we process, integrate and manipulate big data with distributed systems and varied data pipelines and we synthesize results and translate findings into compelling stories that resonate with stakeholders.ResponsibilitiesUse statistical, mathematical, predictive modelling capabilities to ask the right questions and find the right answers.Communicate findings, orally and visually.Has knowledge of Big Data engineering and data manipulation methods and tools and can perform these tasks independently AND/ OR has knowledge of advanced statistical techniques and tools and can perform these tasks independentlyWrites efficient, organized, shareable code, develops ETL processes and functions to automate tasks or produce analytics/ data productsOversees work and provides coaching to junior team members; provides training to new employeesEngages with business stakeholders and translates business problems into analytics projects; summarizes, visualizes and communicates statistical/ML processes and results for stakeholders; helps translate analytics outputs into actionable insightsKnowledge and SkillsMinimum 2 years of relevant experience, preferable with a focus on Big Data AnalyticsExperience building ETL pipelines for cloud-based projects from initial inception to productionExperience implementing a range of statistical or machine learning methods, from basic descriptive statistics, hypothesis testing and feature transformation to complex dimension reduction, supervised or unsupervised learning, and model turning and validationProficiency in Python and/or R, SQLFamiliarity with Linux and/or Spark preferred; knowledge of distributed computing would be a plusDemonstrated ability to communicate complex technical concepts to non-technical audiencesDemonstrated passion for problem solving; ability to perform tasks independently; comfortable with dealing with complex and ambiguous business problemsBenefitsCompetitive salary with bonusesFlexible hoursGenerous vacation policyMedical, dental and vision insuranceLots of room to grow and learn new thingsVery competitive 401k matchingMonster is a global leader in connecting people to jobs, wherever they are. For more than 20 years, Monster has helped people improve their lives with better jobs, and employers find the best talent. Today, the company offers services in more than 40 countries, providing some of the broadest, most sophisticated job seeking, career management, recruitment and talent management capabilities.Monster continues its pioneering work of transforming the recruiting industry with advanced technology using intelligent digital, social and mobile solutions, including our flagship website monster.com® and a vast array of products and services.Accessibility AccommodationMonster provides reasonable accommodations to individuals with disabilities to enable such individuals to participate fully in the application process and during employment. If you require an accommodation for any part of the application process, please send an email to talentacquisition@monster.com or call 1-800-MONSTER and let us know the nature of your request and your contact information. Please do not direct any general employment related questions to this email and/or phone number. Please not that only those inquiries concerning a request for reasonable accommodations will be responded to from this email address and/or phone number.Monster is an Equal Opportunity and Affirmative action Employer M/F/Individuals with Disabilities/Veteran Status.US EEO Verbiage"
"Data Scientist","AboutWeb","Reston, VA",NA,"https://job-openings.monster.com/data-scientist-reston-va-us-aboutweb/212911527","AboutWeb, an award-winning IT solutions and staffing company, is hiring for a Data Scientist to design, develop and deploy data-driven analytical solutions to solve problems and answer questions for clients. This candidate will use data mining, statistical modeling, analytical platforms and business intelligence to develop a lead scoring application for business development for a major international Cable entity.Responsibilities:Contribute to the delivery of scalable and real-time analytical information in support of client decision-making Leverage technical expertise in data mining and predictive analytics to build sound predictive analytical models and produce business intelligence solutions Apply a wide array of advanced data mining techniques (including supervised and unsupervised methods, dimension reduction methods, and social network analysis methods) in support of analytic projects. Position Requirements:strong statistical background and 7+ years of overall experience 3+ years' experience in specialized data mining, predictive modeling, or other data intensive analytical role in a telecommunications environment Strong Python Development skills required Experience with SageMaker Experience with open source Machine learning tools in implementation of machine learning based models Experience in data mining and predictive modeling methodologies, ideally including experience in more than one of the following: supervised, unsupervised, dimension reduction, text and document mining, and social network analysis methods Experience working with large-scale relational databases; ideally with additional hands-on experience with NoSQL databases and related big data tools Experience with analytical programming languages (such as R), SQL, and/or business intelligence tools in the application of data mining and/or predictive modeling; experience using Java, C++, Perl, and other modern programming languages in the deployment of advanced analytics is highly desired Proven ability to design and leverage analytics according to client needs Excellent communication skills, including the ability to effectively communicate model results and technical information to audiences possessing a widely varying level of analytical sophistication US Citizen or Permanent Resident status required to facilitate ease of travel to Client's Canadian based Headquarters for occasional work on customer site. #AW"
"Data Scientist - Contract","Veracity Consulting","Overland Park, KS",NA,"https://job-openings.monster.com/data-scientist-contract-overland-park-ks-us-veracity-consulting/212910505","Veracity Consulting, Inc. is an Information Technology Solutions Provider. We offer our clients value added expertise in the development and use of Information Technology to expand and improve their organization’s business processes. Currently, we are searching for a Data Scientistto join our team in Overland Park, KS. Our team is instinctively curious. It's just how we're wired. That means empowering our people to see the big picture—to cut through the noise so we’re not just treating the symptoms but finding the cure. Founded in 2006, Veracity is a team of problem-solvers and truth-tellers who deliver customized IT solutions for our customers. We bridge the gap between business and technology while always staying transparent and authentic—simply doing the right thing. RESPONSIBILITIES Identify valuable data sources and automate collection processesUndertake preprocessing of structured and unstructured dataAnalyze large amounts of information to discover trends and patternsBuild predictive models and machine-learning algorithmsCombine models through ensemble modelingPresent information using data visualization techniquesPropose solutions and strategies to business challengesCollaborate with engineering and product development teams QUALIFICATIONS Previous experience as a Data Scientist or Data AnalystData Mining experienceMachine-learning & operations research understandingR, SQL and Python knowledgeBusiness Intelligence tools experience (e.g. Tableau)Data frameworks experience (e.g. Hadoop)Strong math skills (e.g. statistics, algebra) ADDITIONAL QUALIFICATIONS Scala, Java or C++ familiarity nice to haveBSc/BA in Computer Science, Engineering or relevant field; graduate degree in Data Science or other quantitative field is preferredAnalytical mind and business acumenProblem-solving aptitudeExcellent communication and presentation skillsRegular and predictable attendance To be considered an applicant for a position, you must: (1) complete the application in full; (2) apply for a specific, available position; and (3) meet all stated minimum qualifications. Applications that are incomplete or are submitted for ""any"" position will not be considered. Applicants are good for 90 days. If you are not selected within 90 days of submission, and remain interested in a position, you must submit a new application. Veracity Consulting provides equal employment opportunities (EEO) to all employees and applicants for employment without regard to race, color, religion, sex, sexual orientation, gender identity, national origin, disability or status as a protected veteran and any other characteristics protected by law. In addition to federal law requirements, Veracity Consulting complies with applicable state and local laws governing nondiscrimination in employment in every location in which the company has facilities."
