"job_title","hiring_companies","location","salary","job_url","job_description"
"GMP Analytical Data Review Scientist (Pharmaceuticals)","Cambrex Corp.","High Point, NC",NA,"https://job-openings.monster.com/gmp-analytical-data-review-scientist-pharmaceuticals-high-point-nc-us-cambrex-corp/212902851","Summary: Cambrex (www.Cambrex.com) is seeking a highly motivated, energetic, results-oriented individual to join our team of dedicated professionals focused on customer service and quality. We are currently accepting resumes for the position of Analytical Data Review Scientist.About the Job:This position will be reporting to the Quality Assurance department and supports the GMP Analytical laboratory. The GMP Analytical laboratory provides analytical services to both GMP and non-GMP manufacturing by supporting development and validation of analytical test methods, evaluation and testing of cleaning samples, raw materials, process intermediates, final APIs, and final dosage forms, characterizing/qualifying Reference Standards, and performing Stability evaluations. All activities are performed in accordance with specifications, standard operating procedures, approved test methods and/or protocols, and regulatory requirements. Responsibilities:Ensures the quality of laboratory data and reports. Efficiently and effectively reviews chromatographic/other data and related notebooks as specified by Standard Operating Procedures (SOPs). Evaluates data to ensure compliance with analytical methods, client criteria, and Good Manufacturing Practices (GMP).Must be able to understand and interpret analytical data (chromatographic and other). Scrutinizes and fully fathoms routine and non-routine testing/other data in order to ensure compliance, accuracy, and completeness of work as well as veracity of results based on documented data.Must be able to critically and in detailed fashion review/verify Reports, SOPs, Specifications, Analytical procedures, etc. Example: Reviews sample results tables and analytical reports for completeness and accurate representation of the data and report findings.Must be able to solve practical problems and deal with a variety of concrete variables in situations where limited standardization exists.Must be able to interpret a variety of instructions furnished in written, oral, diagram, or schedule form.Organizes workflow and tasks to maximize efficiency (e.g., prioritize review/writing based on client/business needs, etc.).Demonstrated ability to work with others at all levels of the organization and have basic knowledge of computers and industry-related software.Ability to work effectively under pressure to meet deadlinesEnsures compliance with company policies and SOPs as well as FDA and other applicable guidelines. Minimum Requirements:The successful candidate will hold a minimum of a Bachelor’s degree in Chemistry, Biology, Microbiology, or closely related discipline, and 4 years relevant pharmaceutical laboratory/analytical experience, including a minimum requirement of 2 years of data review experience. This candidate will have a broad background in analytical methodology, strong comprehension, and demonstrated skills in review of analytical and compliance oriented data and documentation. Strong attention to detail is a requirement. Thorough knowledge of SOPs, cGMPs, and Federal Regulations are a strong positive. Prior HPLC/GC/Other Instrumental experience is required. Certified Quality Auditor or similar is a strong plus. Hands-on experience in technical writing is a plus. Other Experience/Skills: In-depth work experience in an analytical contract laboratory environment is a strong positive. Experience in stability study performance/evaluation is helpful. Excellent verbal and written communication/interpersonal skills, problem-solving skills, organizational skills, and the ability to work in a diverse team environment are essential. Proficiency with Microsoft software (Word / EXCEL / PowerPoint) is expected.Please send all resumes to:CambrexAttention: Human Resources4180 Mendenhall Oaks PkwyHigh Point, NC27265Cambrex offers Custom organic synthesis, cGMP scale-up, Contract research, Molecular building blocks, Medicinal chemistry services and is a leader in fostering the commercial development of small molecule drug discovery and development in pharmaceutical, discovery platform, and biotechnology companies. The Cambrex offering parallels the drug discovery process and provides significant advantages at each step from lead discovery to lead optimization, chemical synthesis and scale-up of pharmaceutical intermediates as well as chemical process R&D.At Cambrex, we recognize people as our most valuable asset. Our competitive salary and benefits package includes 401K, dental insurance, medical insurance, disability benefits, life insurance, a vision-care plan, paid sick time, casual dress, paid company holidays and paid vacations. Cambrex is an Equal Opportunity Employer."
"Data Scientist","Meridian","Detroit, MI",NA,"https://job-openings.monster.com/data-scientist-detroit-mi-us-meridian/212655319","OverviewWho we are:Meridian, a WellCare Company, is part of a national network of passionate leaders, achievers, and innovators dedicated to making a difference in the lives of our members, our providers and in the healthcare industry.We provide government-based health plans (Medicare, Medicaid, and the Health Insurance Marketplace) in Michigan, Illinois, Indiana, and Ohio. As a part of the WellCare Family of companies, we deliver healthcare excellence to millions of members nationwide.Our associates work hard, play hard, and give back. Meridian associates enjoy an exceptional experience and culture including special events, company sports teams, potlucks, Bagel Fridays, and volunteer opportunities. A Day in the Life of a Data Scientist:The Data Scientist is part of a team that researches and investigates business problems through quantitative analysis using healthcare cost, utilization, clinical, assessment, and external data. This position also conducts the on-going presentation of analysis results and findings to support clinical programs, healthcare business operations, performance and improvement.ResponsibilitiesEssential Functions: Gather and prepare analyses based on information from internal and external sources to evaluate and demonstrate program effectiveness and efficiency (10%) Leverage knowledge of programming, mathematics and computer science to transform the way our company does business Translate business opportunities into data-driven big-data and modeling solutions using statistical, econometric or data-mining tools and methods Analyze and extract data from the Enterprise Data Warehouse (EDW) to report to internal and external customers (5%) Working in big data environment with Oracle and Hadoop environment to bring actionable insights with R, SAS, Python or other statistical packages Research complex functional processes and industry standards using a variety of resources (5%) Educate the organization both from IT and the business perspectives on new analytic methods and technologies Develop and prepare highly complex reports and provide and/or interpret information and data across divisions and departments (15%) Communicate complex analysis clearly to all audience through use of data visualization tool such as Tableau Gain an understanding of how data integrates across multiple transaction systems to create complex reporting solutions for actionable insights Assume responsibility for data integrity among various internal groups and/or between internal and external sources (5%) Design integrated and clinically-based engineering, management, medical and environmental solutions aiming at providing person-centered care to members, households and their respective communities with emphasis on health, social, economic and environmental sustainability (15%) Using statistical methods such as linear models (linear regression, generalized linear regression, logistic regression) and nonlinear modeling techniques to build predictive models to help drive better member engagement and impactability Lead the research and development of predictive models and capabilities using machine learning and artificial intelligence Segment target population using supervised (classification) and unsupervised (clustering) learning methods to identify most impactful members Conduct economic/outcomes analyses to quantify savings obtained from integrated solutions.(10%) Evaluate return of investment (ROI), utilization and compare them with pre-defined goals to measure effectiveness of program Develop meaningful data visualizations in form of dashboards to communicate results and empower senior executives’ decision making process Develop systematic and scalable reporting processes and procedures to ensure timely delivery of weekly, monthly, quarterly, annual and ad hoc reporting to management (10%) Develop and improve algorithms like risk stratification methodology, pregnancy identification, etc. that is applied to all member on a monthly basis Recommend and implement new or modified reporting methods and procedures to improve report content and completeness of information (15%) Analyze benchmarking data, reports, processes, and measurements for key managed care indicators to recognize trends and assist in developing population health initiatives Serve as a mentor to junior staff (5%) Perform all other related duties as assigned (5%)QualificationsJob Requirements:Education:Master’s Degree or higher in Data Science, Biostatistics/Statistics, Econometrics or related field Experience:5+ years of experience in advanced analytics experience, machine learning, statistics, or econometrics role and who has solid analytical skills using, SAS, R, or Python Advanced knowledge of statistical and mathematical principles Experience in Regression Analysis, Predictive Modeling, Data Mining, Machine Learning and Forecasting Experience in Propensity Modeling for control group and treatment group testing Experience in designing research experiments and measuring their effectiveness. Experience with healthcare claims data Experience with peer-reviewed publications Experience with Six Sigma, Triple Aim and/or other relevant Project Management tools Strong SQL Scripting, Statistical Programming, Data Visualization and Communication skills Ability to interpret and communicate statistical results to a non-technical audience Working knowledge of Predictive Modeling and Grouper tools such as John Hopkins ACG System, Optum Symmetry, or related population health platform system(s) Knowledge:Must be familiar with common database architectures and understand how to extract necessary data Must have strong proficiency in MS Excel (pivot tables, macros, lookups, etc.) and common analytic tools such as SAS, SQL, SPSS (writing queries, troubleshooting queries, extracting data, etc.) Knowledge about Medicare, Medicaid and Commercial Managed Care preferred Working knowledge of Healthcare Effectiveness Data Information Set (HEDIS) specifications and CAHPS survey requirements Knowledge of health care quality improvement processes and documentation Skills/Tools:At least 2 years of experience with SQL Server or Oracle At least 2 years of experience with SAS or R At least 2 years of experience with MS Excel At least 2 years of experience with Data Visualization in Excel, R or Tableau Experience with Oracle BI Answers a plus, not required Experience with MS Access a plus, not required Excellent written, verbal, presentation skills and inter-personal skills Strong clinical analytical and data interpretation skills Strong project management skills required; must be very organized and detail oriented Strong written and oral communication skills required; must be able to interact with all levels within an organization Abilities:Must be able to execute complex clinical analyses using sound epidemiological concepts and methodologies Must be able to produce requested analyses on a production schedule Ability to present analytical findings to leadership to enable data-driven decisions Must be able to interact with a variety of clinical operations SMEs to organize analytic plans and requirements for clinical analytic requests Ability to work in a collaborative, virtual team environment and analyze problems using a team approachMust be a team player and someone with ability to work with minimal guidance in fast-paced work environment.Ability to influence and manage a diverse set of stakeholders (clinical and nonclinical), both internally and externally Ability to think creatively to resolve common barriers and issues Ability to deal with ambiguity of ad hoc reporting requests, ask questions to seek clarification, and deliver results #MSTR"
"Data Scientist","Randstad Technologies","San Diego, CA",NA,"https://job-openings.monster.com/data-scientist-san-diego-ca-us-randstad-technologies/212903174","job summary:Randstad is looking for a Data Scientist on a direct hire basis for a client located in the 92121 area of San Diego. location: San Diego, Californiajob type: Permanentsalary: $90,000 - 150,000 per yearwork hours: 8am to 5pmeducation: Masters responsibilities:Responsibilities include:•Research and develop AI/Deep Learning algorithms for company•Discuss roll-out and impact of implemented algorithms•Work with Data Structures (i.e. - SQL databases, NoSQL, etc.)•Implement neural network models•Statistical analyses using Python using PyTorch, TensorFlow, scipy, sklearn, etc.•Improve internal C/C++ libraries and integrate the library with AI frameworks qualifications:Required Skills: •Master's Degree in data Science, Physics, Machine Learning, CIS, CS or mathematics related field•3+ years of professional experience with•Deep understanding of AI/Machine Learning and algorithms•Programming experience with C++ and Python skills: Desired Skills:•A.I./M.L. Publications•Have attended A.I./M.L. Conferences•Passionate about A.I./M.L.Skills: A.I./M.L., C++, Python, Data, Science, SQL, NoSQL, sklearnEqual Opportunity Employer: Race, Color, Religion, Sex, Sexual Orientation, Gender Identity, National Origin, Age, Genetic Information, Disability, Protected Veteran Status, or any other legally protected group status. Qualified applicants in San Francisco with criminal histories will be considered for employment in accordance with the San Francisco Fair Chance Ordinance.We will consider for employment all qualified Applicants, including those with criminal histories, in a manner consistent with the requirements of applicable state and local laws, including the City of Los Angeles' Fair Chance Initiative for Hiring Ordinance."
"Data Scientist","Acara Solutions","Coraopolis, PA",NA,"https://job-openings.monster.com/data-scientist-coraopolis-pa-us-acara-solutions/212907097","Acara is looking for Data Scientist for our client located in Coraopolis, PA.Our client is looking for Data Scientist.Required Skills / Qualifications:Bachelor’s Degree in Engineering, Data Analytics, or Computer Science.Minimum of 3 years’ experience writing SQL and PL/SQL.Minimum of 3 years’ experience with project management/ownership.Minimum of 3 years’ experience with advanced analytics such as machine learning and AI.Minimum of 3 years’ experience with data frames and data modelling.Preferred Skills / Qualifications:Experience working with customers.Experience with SQL query and performance tuning.Experience with data ETL processes/software.Oracle certifications.Familiar with Oracle’s APEX.Advanced skills in Python Data Analytics Packages, R, or similar.Familiar with Oracle databases.Familiar with Power BI/Tableau or other business intelligence software.To cross train others in areas of expertise.To work well independently as well as within groups.To communicate clearly, especially when conveying technical concepts to individuals without a technical background.To think critically, problem solve, and develop new solutions.Additional description:Upon offer of employment, the individual will be subject to background check and a drug screen.Aleron companies; Acara Solutions, Aleron Shared Resources, Broadleaf Results, Lume Strategies, Viaduct, and Aleron’s strategic partner, SDI are Equal Employment Opportunity and Affirmative Action Employers. All qualified applicants will receive consideration for employment without regard to race, color, religion, gender identity, sexual orientation, national origin, genetic information, sex, age, disability, veteran status, or any other legally protected basis.Applicants for this position must be legally authorized to work in the United States. This position does not meet the employment requirements for individuals with F-1 OPT STEM work authorization status."
"Lead Data Scientist - Population Health, Data Mining","CyberCoders","Santa Cruz, CA",NA,"https://job-openings.monster.com/lead-data-scientist-population-health-data-mining-santa-cruz-ca-us-cybercoders/212878691","If you are a Data Scientist, Healthcare with experience, please read on!We are a well-known and well-established SaaS company catering to a $3 trillion dollar industry! We've been in the game for the past 30 years, and are now looking to build out our healthcare and financial services team! We have an urgent need for a Senior Data Scientist with a healthcare background design and develop data-driven software solutions! If you're a Senior Data Scientist looking to have a positive impact on society, then please apply today!Top Reasons to Work with Us1.Industry Stability2.Talented technical team3.Upward career growthWhat You Will Be DoingResponsible for leading the design and development of advanced analytics initiatives. You will be the subject matter expert and manage the predictive modeling, data mining, statistical analysis, AI projects and decision models to address business issues related to healthcare management and payment models.What You Need for this Position5+ Years of professional experience and knowledge of:•Master’s degree in Data Science•Healthcare experience required•Predictive Analytics, Data Modeling, Data Mining•Proficiency with SQL •Ability to build Algorithms from scratchWhat's In It for YouEXCELLENT benefits Including:- Competitive salaries (DOE)- Company-paid healthcare - Vacation/PTO- Medical- Dental- Vision- 401(k)*** Work from home 2 days a week! ***So, if you're a Data Scientist with healthcare industry experience, please apply today!Security Clearance will be needed - therefore, only US citizens can be considered."
"Sr. Data Scientist","APC","Chapel Hill, NC",NA,"https://job-openings.monster.com/sr-data-scientist-chapel-hill-nc-us-apc/212474329","We are actively seeking a Senior Data Scientist to work at our client's location in Chapel Hill, NC. This is a 6-month contract to hire opportunity.The Sr. Data Scientist will have the opportunity to make an immediate impact working collaboratively with a team of experts with diverse functional skills, to continually build your own competencies in a learning-obsessed environment, and to identify and solve problems in the rapidly evolving patient health space.Responsibilities:Develop predictive and prescriptive analytics addressing patient engagement, patient adherence, patient pathways, and clinical outcomes. Develop workflows to manage the full data life cycle from acquisition to actionable outcomes. Collaborate with our internal team to brainstorm and contribute to collectively advance the analytics portfolio. Use statistical and machine learning methods to develop, improve and test a variety of prescriptive and predictive models. Supervise design, analysis and presentation of findings from pilot studies and observational research, using classical statistical methods (multivariate regression and survival analysis). Specify, monitor, test software codes and systems working with vendors. Maintain current knowledge of best practices and advances in predictive analytics and machine learning. Collaborate to develop white papers and build presentations.Requirements:Master’s or Ph.D. in Computer Science, Engineering or closely related field. 5+ years of experience, with not less than 3 years in the healthcare field. Experience in patient analytics, using claims, refill, electronic medication monitoring, and/or self-reported data a plus. Proficient user of data science software such as R and Python along with experience with Spark or similar tools. Experience working with SAS, SQL, SPSS, or Stata. Experience with data visualization and presentation. Adept at presenting complex concepts to colleagues and customers Strong communication skills and ability to collaborate with others.Job Requisition # 29906APC believes that the workplace should be fun and enjoyable. Join our team today and ignite your career!Meet APC Company – Staffing – 501 – 1000 employees APC is a professional services organization focused on engaging people and positively impacting lives. We offer excellent benefits and the opportunity for longevity, working with our premier fortune 100 clients. As professionals serving professionals, we take pride in providing our employees with the highest level of customer service and support, creating meaningful, fulfilling and rewarding experiences every day."
