"job_title","hiring_companies","location","salary","job_url","job_description"
"Principal Data Scientist (USBU)","Takeda","Lexington, MA",NA,"https://job-openings.monster.com/principal-data-scientist-usbu-lexington-ma-us-takeda/212889585","By clicking the “Apply” button, I understand that my employment application process with Takeda will commence and that I agree with Takeda’s Privacy Notice, Privacy Policy and Terms of Use.Job DescriptionPrincipal Data Scientist Are you looking for a patient-focused, innovation-driven company that will inspire you and empower you to shine? Join us as a Principal Data Scientist in our Cambridge, MA office.At Takeda, we are transforming the pharmaceutical industry through our R&D-driven market leadership and being a values-led company. To do this, we empower our people to realize their potential through life-changing work. Certified as a Global Top Employer, we offer stimulating careers, encourage innovation, and strive for excellence in everything we do. We foster an inclusive, collaborative workplace, in which our global teams are united by an unwavering commitment to deliver Better Health and a Brighter Future to people around the world.Here, you will be a vital contributor to our inspiring, bold mission.As a Principal Data Scientist working on the US Medical Affairs team, you will be empowered to provide analytical and statistical expertise and leadership. In this role, you will contribute to Takeda’s mission by providing strategic statistical input to feasibility assessments. A typical day will include:OBJECTIVE:• Independently designing, analyzing, and interpreting clinical studies, health economics and outcomes research (HEOR) studies, and real world data at a product level.• Providing strategic analytical and statistical input for feasibility assessments, cross-study analyses, and marketing activities.• Leveraging internal and external resources to achieve quality, timely, and cost-effective product level deliverables.• Independently representing US Outcomes Research & Data Science in interactions with clinicians and other functions.ACCOUNTABILITIES:• Independently represent statistics function on clinical and HEOR teams in support of clinical studies and product level programs.• Provide strategic statistical input to feasibility assessments, development, and marketing plans. Negotiate timelines (statistical) at product level.• Plays a leadership role in the development and review of the study synopsis, protocol, statistical analysis plan, clinical study report, and other analysis documents, ensuring accurate and statistically valid deliverables.• Oversee definition and implementation of product-level database (including derived database), analysis and reporting standards. Plan and direct product level analysis and reporting activities (eg, tables, listings, graphs).• Identify product-level vendor requirements and participate in the evaluation and selection of vendors. Provide product-level analytical oversight of statistical activities of external vendors to ensure timeliness and quality of analysis data and statistical outputs. Review and approve key statistical vendor deliverables.• Identify and interact with external statistical experts for issues related to study design, methodology and results.• Anticipate and communicate internal and external resource and quality issues that may impact deliverables or timelines of the product level program. Propose and implement solutions. Escalate issues to management as appropriate in a timely manner.• Monitor and contribute to industry advances in statistical methods to optimize study designs and statistical analysis methods, and implement innovative approaches at a product level.EDUCATION, EXPERIENCE AND SKILLS:• Generally requires a PhD in statistics, biostatistics, epidemiology, health services research, or other health-related analytical fields with at least 5 years of relevant experience or an MS with at least 7 years of relevant experience.• Experience with advanced epidemiology or health outcomes study designs.• A minimum 5 years experience in healthcare data, including administrative claims databases and/or electronic health records• Advanced knowledge of HEOR study design and methodology, descriptive and inferential statistics, and exploratory data analysis.• Advanced knowledge of the pharmaceutical industry including understanding of health care reimbursement systems and related coding systems (e.g., ICD-10, CPT, DRG, etc.).• Good knowledge of statistical programming languages (including SAS), software, techniques, and processes. Working knowledge of UNIX operating systems, and common software products and technologies used in conjunction with SAS (e.g., Microsoft OfficeÒ products).• Excellent oral and written communications skills.• Strong project management skills.• Strong collaborative skills and ability to work with a cross-functional team.PHYSICAL DEMANDS:The physical demands described here are representative of those that must be met by an employee to successfully perform the essential functions of this job. Reasonable accommodations may be made to enable individuals with disabilities to perform the essential functions.• Ability to sit and stand for long periods of time.• Carrying, handling and reaching for objects.• Ability to lift and carry over 25 pounds.• Manual dexterity to operate office equipment i.e. computers, phones, etc.TRAVEL REQUIREMENTS:• Access to transportation to attend various meetings held in proximity to the Takeda offices.• Able to fly to various meetings at investigator, vendor, or regulatory agency sites.• Some international travel may be required.WHAT TAKEDA CAN OFFER YOU: 401(k) with company match and Annual Retirement Contribution PlanTuition reimbursement Company match of charitable contributionsHealth & Wellness programs including onsite flu shots and health screeningsGenerous time off for vacation and the option to purchase additional vacation daysCommunity Outreach ProgramsEmpowering Our People to Shine Learn more at takedajobs.com.No Phone Calls or Recruiters Please.#LI- AS2LocationsLexington, MAWorker TypeEmployeeWorker Sub-TypeRegularTime TypeFull time"
"Data Scientist (1801)","Interactive Brokers LLC","New York, NY",NA,"https://job-openings.monster.com/data-scientist-1801-new-york-ny-us-interactive-brokers-llc/212910338","Job Description and ResponsibilitiesInteractive Brokers Group (IBG) is looking for a junior Data Scientist. The successful candidate will execute analytical tasks on large data sets to support decision makers and provide insight and reports about our platforms. The data scientist role will use data to help us better understand who our clients are, how they engage with our products and services and how we can better serve them by identifying interesting and useful trends in our data. You will make an impact by using your passion for data and analysis to generate actionable insights that we will use to improve the experience for our clients. The position responsibilities include but are not limited to: Collect and analyze various telemetry and behavioral dataProduce daily metrics and reportsClean and prepare data for Machine Learning and A.I.Assist with designing and running A/B testsAutomate frequently used reporting and data analysis workflowsWork closely with software engineers and architects to extract, transform and standardize data for optimal use for analytic toolsQualificationsBachelors in Computer Science, Mathematics, Statistics or related fields; Masters strongly preferred2+ years' experience in a data science or data analysis role2+ years of Java coding experience2+ years mining and analyzing data sets to extract meaningful trends, producing meaningful and actionable reportsExperience using statistical programming languages, machine learning and other toolkits and techniques for analyzing large, complex datasetsTechnical proficiency with transforming structured and unstructured data setsStrong analytical skills, attention to detail and accuracyExpert problem solving skills and creative thinking ability This position is not sponsoring for employment authorization to work in the U.S.Company OverviewInteractive Brokers (""IBKR""), a subsidiary of publicly-traded Interactive Brokers Group, Inc., based in Greenwich, Connecticut (IEX: IBKR) is a low-cost provider of trade execution and clearing services for active traders, institutional investors, financial advisors and introducing brokers. IBKR’s premier technology provides electronic access to stocks, options, futures, forex, bonds, and funds worldwide from a single IBKR Integrated Investment account. IBKR is one of the largest online brokers by trade volume and is consistently ranked at the top of its field.Our employees are part of a dynamic, multinational, fast-paced, results-oriented team working to provide our customers with state-of-the-art trading technology, superior execution capabilities, worldwide electronic access, and sophisticated risk management tools.Our headquarters are in Greenwich, CT, USA. IBKR has offices in the United States, Canada, the United Kingdom, Switzerland, Hungary, Estonia, Russia, India, Hong Kong, China, Japan and Australia.IBKR is a member of NYSE, FINRA, and SIPC. Interactive Brokers Group brokerage affiliates are regulated by securities and commodities agencies around the world.Curious about our what it's like to work at IBKR? Click the HERE to view a short message from current employees. For more information, please visit www.ibkr.com/info"
"Associate Data Scientist","AIC","Neptune Beach, FL",NA,"https://job-openings.monster.com/associate-data-scientist-neptune-beach-fl-us-aic/212481195","Job Title: Associate Data ScientistLocation: Jacksonville, FLDuration: 7+ months contractCandidate should have experience in some form of SQL (e.g. HIVE, PostgreSQL, MSSQL, etc.) and either Python or R for statistical application development. Experience in a Hadoop environment and / or statistical development tool (e.g. RapidMiner, Knime) a plus."
"Data Scientist","Mindteck (India) Limited","Boston, MA",NA,"https://job-openings.monster.com/data-scientist-boston-ma-us-mindteck-india-limited/212900813","Should you be offered a position as a Mindteck Consultant, you can take advantage of our very competitive and often above market compensation and one of the best benefit packages the consulting industry has to offer.Package Overview:Competitive Salary401k Retirement PlanAffordable Medical, Dental and Vision PlansHealth Savings Account (HSA)Life/AD&D, Short- and Long-Term Disability BenefitsPaid Time OffPaid HolidaysTitle: Data Scientist,19-01280Location: Boston, MA.Duration: 6+ months Long term contractThe TeamThe AI/ML (Artificial Intelligence and Machine Learning) team contributes to the vitality and growth of the organization through researching and building complex, cutting edge and scalable AI algorithms, models, platforms and technologies to significantly improve customer experience and drive business results. Our team of high caliber scientists, mathematicians and statisticians use rigorous quantitative approaches to ensure that we are efficiently building algorithms and technology relevant to the business or customer experience issue at hand.The Expertise You HaveMinimum Master’s Degree in Engineering, Computer Science, Mathematics, Computational Statistics, Operations Research, Machine Learning or related technical fields3+ years’ experience as a Data Science professional with focus on developing and deploying practical solutions for business problemsStrong programming skills in Python/R/Matlab/Spark/Scala and SQL is a must haveHands on experience developing and deploying supervised and unsupervised machine learning algorithms (regression, decision trees/random forest, neural networks, feature selection/reduction, clustering, parameter tuning, etc.),Experience with financial data sets is nice to haveThe Skills You BringYour solid skills in algorithm development and predictive modelingProgramming skills to help us implement our ideasThe Value You DeliverYou will partner with stakeholders create business and technical requirements, transform large volumes of data into AI-driven solutions using cutting edge open source technologies.The ideal candidate will combine expert ML knowledge with hands on experience building algorithms, and outstanding business skillsAbout MindteckJoin Us! We're a growth-oriented company that needs the valuable contributions you Data Scientist to join our team in Boston, MA.While others say it, we do it: We Care. We've helped thousands of talented individuals carve out their role and have a healthy work-life balance.Just like life, you'll experience a good mix of challenges and opportunities. But we'll be rooting for you along the way.Apply Today!Presently, Mindteck employs over 1,000 individuals throughout offices in:USUKSingaporeMalaysiaBahrainIndiaIt also has four development centers (US, Singapore and India [Kolkata, Bangalore]).The company is listed on the Bombay Stock Exchange (BSE 517344) and is among a select group of global companies appraised at Maturity Level 5, Version 1.3 of the CMMI Institute’s Capability Maturity Model Integration (CMMI)www.Mindteck.comMindteck is an Equal Employment Opportunity (EEO). All qualified applicants will receive consideration for employment without regard to race, religion, color, national origin, sex, sexual orientation, gender identity, age, status as a protected veteran, status as a qualified individual with a disability, or any other trait protected by lawJoin our Talent Network: http://goo.gl/uyDz8N"
"Data Scientist, Principal","XPO Logistics Freight Inc.","Ann Arbor, MI",NA,"https://job-openings.monster.com/data-scientist-principal-ann-arbor-mi-us-xpo-logistics-freight-inc/212889826","Logistics done differently. At XPO Logistics, we invest hundreds of millions in technology every year so that we can continue to develop state-of-the-art solutions for our customers. Are you looking for an opportunity to take your career to the next level with a rapidly expanding global company? As the Principal Data Scientist, you will be responsible for leading and driving the overall design and development of end-to-end data science solutions to support strategic business and IT initiatives. You will also coordinate the execution of work across team members, guide architectural troubleshooting and communicate progress and results. Become a part of our growing, dynamic team and we'll help you develop to a level that will exceed your expectations. Pay, benefits and more. We are eager to attract the best, so we offer competitive compensation and a generous benefits package, including full health insurance (medical, dental and vision), 401(k), life insurance, disability and the opportunity to participate in a company incentive plan. What you’ll do on a typical day: Lead design and architect solutions for data science and data engineering projects; confirm delivery requirements and plan, track and communicate resources and delivery plan; assist with development work as needed Understand and improve data science standard patterns, templates and artifacts for platform architecture, data science development approaches, data models and new technology adoption and rollout Define patterns and share technical approaches and best practices among other developers; simplify and communicate completed work to broader audiences across the company Mentor other team members on technical skills, best practices, problem-solving approaches and standard patterns Troubleshoot technical issues in existing processes and current development work, solicit assistance from other roles and groups, and drive resolution to ensure the integrity of platform quality and project timelines Allocate team resources across projects to balance the workload according to available capacity, planning dependencies and prevailing priorities Collaborate with IT and business teams to identify and document use cases, performance and capability requirements, and criteria for successful solution delivery Support data consumers to ensure they have reliable access to trusted data, and provide occasional 24/7 on-call production support What you need to succeed at XPO: At a minimum, you’ll need: Master's degree in Computer Science, MIS, Engineering, Business or a related field 10 years of experience leading and delivering business solutions that rely on data science, Business Intelligence (BI), data warehousing or similar domains Successful delivery of 10 or more projects in data science, data engineering or data integration as a tech lead/principal Strong understanding of the core principles of data science and machine learning; experience developing solutions using related tools and libraries Ability to analyze, summarize and characterize large or small data sets with varying degrees of fidelity or quality; able to identify and explain any insights or patterns within them Solid experience applying one or more of the following analytical methods: regression (preferably mixed models), data classification and reduction (cluster, factor, principle components, decision trees), Bayesian inference or other advanced machine learning techniques Strong understanding of and experience with advanced statistical theoretical knowledge Solid experience in exploratory data analysis and visualization using R and Python (Numpy, Pandas, Scipy, Plotly, Matplotlib) It’d be great if you also have: Data Science specialization from Coursera, Udacity, Data Camp, etc., Certified Business Intelligence Professional from TDWI, Certified Data Management Professional from DAMA, and/or certifications in data modeling and data engineering 10 years of hands-on experience in delivering solutions in at least two of the following areas: data science, data modeling, data integration or BI 5 years of hands-on experience in delivering solutions in at least two of the following areas: data science, data analysis, geo spatial, finance, econometrics, Cloud computing, big data or database management Be part of something big. XPO is a leading provider of cutting-edge supply chain solutions to the most successful companies in the world. We help our customers manage their goods most efficiently using our technology and services. Our greatest strength is our global team – energetic, innovative people of all experience levels and talents who make XPO a great place to work. We are proud to be an Equal Opportunity/Affirmative Action employer. Qualified applicants will receive consideration for employment without regard to race, sex, disability, veteran or other protected status. The above statements are intended to describe the general nature and level of work being performed by people assigned to this classification. They are not intended to be construed as an exhaustive list of all responsibilities, duties and skills required of personnel so classified. All employees may be required to perform duties outside of their normal responsibilities from time to time, as needed."
"2020 Citizen Data Scientist Internship","FCA","Detroit, MI",NA,"https://job-openings.monster.com/2020-citizen-data-scientist-internship-detroit-mi-us-fca/212893769","FCA US LLC College Intern Program offers a unique opportunity for highly motivated, innovative, and inspired individuals to work on a challenging assignment where contribution, teamwork, and communication are vital to the success of the organization. As a leading-edge company, we can provide real world challenges and rewarding intern experiences to candidates from a variety of colleges and universities while providing a competitive salary. Interns are assigned to an organization department based on the candidate's background, skill set and interests. The assignments are project-oriented, meaningful to the department and allow the intern to take responsibility for a major task. Interns experience sense of personal accomplishment and contribution, and experience the corporate business culture through work assignments and structured activities. They gain the communication and etiquette skills required in business while sharing knowledge gained from recent courses. They also enhance their computer skills and learn new systems and software. Each 2020 Intern assignment consists of challenging projects with specific goals, providing opportunities for personal growth and development. Interns that demonstrate outstanding qualities may be invited back the following year for a second internship or to interview for full-time positions in various new hire programs. Summer internships are primarily located at the FCA US Headquarters and Technology Center in Auburn Hills, Michigan, other facilities in the Detroit metropolitan area, and business centers located throughout the country. Interns may qualify for a housing allowance and/or travel assistance. During the internship, Interns will have the opportunity to participate in many activities designed specifically to enhance their knowledge of FCA and our products. The student selected for the Citizen Data Scientist Internship will gain experience in requirement gathering, planning, execution, and delivery of data science and machine learning-based projects. This delivery may include creating data visualizations. The bulk of the work will be in areas of data exploration and preparation, data collection and integration. The Citizen Data Scientist will get to gain experience with machine learning (ML) and statistical modeling and data pipe-lining and deployment. The Citizen Data Scientist will assist in cataloging the FCA enterprise wide data catalog, focusing on technical and business documentation. Example projects could include creating a predictive model of when to place an incentive on a model and/or understanding current market conditions related to inventory. Job responsibilities include but not limited to:Collaborates with business analysts and product owners to ensure understanding of business requirementsData Exploration and Preparation: Apply statistical analysis and visualization techniques to various dataGenerate and test hypotheses about the underlying mechanics of the business process Data Collection and Integration: Understand new data sources and process pipelinesCatalog and document their use in solving business problemsData Cataloging: Assisting in the creation of a data catalog that will understand all the relevant data and metadata in the FCA environment, this will include gathering business process and technical informationMachine Learning and Statistical Modelling: Apply various ML and advanced analytics techniques to perform classification or prediction tasksTesting of ML models, such as cross-validation, A/B testing, bias and fairness"
